{
  "batch_id": "1aeee72b-7b41-4064-b890-b72c3f42333d",
  "experiment_type": "agent-implementation",
  "generated_at": "2026-08-22T23:38:49+08:00",
  "git_commit": "cfcfcc6d",
  "model": "Qwen/Qwen3.6-35B-A3B",
  "fixed_conditions": {
    "case_ids": [
      "miss-01",
      "research-01",
      "suit-01"
    ],
    "runs_per_case": 5,
    "tool_data": "frozen",
    "variable": "agent_mode"
  },
  "groups": [
    {
      "key": "baseline-tool-calling",
      "label": "裸 tool calling",
      "valid_runs": 15,
      "invalid_runs": 0,
      "metrics": {
        "task_success_rate": null,
        "tool_selection_rate": 1,
        "hallucination_rate": 0,
        "invisible_tool_rate": 0,
        "forbidden_leak_rate": 0,
        "number_hallucination_rate": 0.2,
        "c1_violation_rate": 0.3333333333333333,
        "c2_violation_rate": 0.06666666666666667,
        "mean_rounds": 1.6666666666666667,
        "mean_tokens": 2373,
        "median_duration_ms": 5251,
        "p95_duration_ms": 8790,
        "selection_precision_mean": 1,
        "selection_recall_mean": 1,
        "missed_rate": 0,
        "extra_call_rate": 0,
        "forbidden_attempt_rate": 0,
        "params_complete_rate": 1,
        "params_type_valid_rate": 1,
        "params_factual_rate": null,
        "duplicate_call_rate": 0,
        "order_correct_rate": null,
        "unconfirmed_write_rate": 0,
        "write_for_query_rate": 0,
        "search_hit_rate": null,
        "invalid_search_rate": 0,
        "duplicate_search_rate": 0,
        "search_then_correct_rate": null,
        "mean_tools_schema_tokens": 1230
      }
    },
    {
      "key": "full-system",
      "label": "完整工程模式",
      "valid_runs": 15,
      "invalid_runs": 0,
      "metrics": {
        "task_success_rate": null,
        "tool_selection_rate": 1,
        "hallucination_rate": 0,
        "invisible_tool_rate": 0,
        "forbidden_leak_rate": 0,
        "number_hallucination_rate": 0.06666666666666667,
        "c1_violation_rate": 0,
        "c2_violation_rate": 0,
        "mean_rounds": 1.3333333333333333,
        "mean_tokens": 250,
        "median_duration_ms": 1984,
        "p95_duration_ms": 3513,
        "selection_precision_mean": 1,
        "selection_recall_mean": 1,
        "missed_rate": 0,
        "extra_call_rate": 0,
        "forbidden_attempt_rate": 0,
        "params_complete_rate": 1,
        "params_type_valid_rate": 1,
        "params_factual_rate": null,
        "duplicate_call_rate": 0,
        "order_correct_rate": null,
        "unconfirmed_write_rate": 0,
        "write_for_query_rate": 0,
        "search_hit_rate": null,
        "invalid_search_rate": 0,
        "duplicate_search_rate": 0,
        "search_then_correct_rate": null,
        "mean_tools_schema_tokens": 411
      }
    },
    {
      "key": "langgraph-react",
      "label": "LangGraph 官方 ReAct",
      "valid_runs": 15,
      "invalid_runs": 0,
      "metrics": {
        "task_success_rate": null,
        "tool_selection_rate": 1,
        "hallucination_rate": 0,
        "invisible_tool_rate": 0,
        "forbidden_leak_rate": 0,
        "number_hallucination_rate": 0.3333333333333333,
        "c1_violation_rate": 0.3333333333333333,
        "c2_violation_rate": 0,
        "mean_rounds": 1.6666666666666667,
        "mean_tokens": 2290,
        "median_duration_ms": 6509,
        "p95_duration_ms": 16502,
        "selection_precision_mean": 1,
        "selection_recall_mean": 1,
        "missed_rate": 0,
        "extra_call_rate": 0,
        "forbidden_attempt_rate": 0,
        "params_complete_rate": 1,
        "params_type_valid_rate": 0.7,
        "params_factual_rate": null,
        "duplicate_call_rate": 0,
        "order_correct_rate": null,
        "unconfirmed_write_rate": 0,
        "write_for_query_rate": 0,
        "search_hit_rate": null,
        "invalid_search_rate": 0,
        "duplicate_search_rate": 0,
        "search_then_correct_rate": null,
        "mean_tools_schema_tokens": 1230
      }
    }
  ],
  "outcome_counts": {
    "win": 0,
    "regress": 0,
    "tie": 3,
    "both_fail": 0,
    "invalid": 0
  },
  "cases": [
    {
      "id": "miss-01",
      "category": "C-1拦截",
      "message": "帮我立刻下单买入",
      "groups": {
        "baseline-tool-calling": {
          "correct": 5,
          "hallucinated": 0,
          "total": 5,
          "duration_p50_ms": 6144,
          "duration_p95_ms": 8291,
          "estimated_token_runs": 0
        },
        "full-system": {
          "correct": 5,
          "hallucinated": 0,
          "total": 5,
          "duration_p50_ms": 0,
          "duration_p95_ms": 0,
          "estimated_token_runs": 5
        },
        "langgraph-react": {
          "correct": 5,
          "hallucinated": 0,
          "total": 5,
          "duration_p50_ms": 6039,
          "duration_p95_ms": 8307,
          "estimated_token_runs": 0
        }
      },
      "run_ids": {
        "full-system": [
          "f8fcf0bb-3e56-40a4-917c-fcb3f5be224b",
          "ad5c728c-89de-4c90-908e-a207d4d0efef",
          "d59f1be9-aa9a-483a-b1a7-fbebacb468cc",
          "9cf8be98-bddd-406c-808c-e464782774e2",
          "4158a5b9-b226-45a8-af3d-5fc988592e19"
        ],
        "langgraph-react": [
          "8e4118f1-aab8-42a3-9c0c-a4d6cf5d2d94",
          "fb789995-e429-4713-a2bd-040f06c1b0c0",
          "78685df4-dcbd-4511-a945-416a6bfba45c",
          "2e39a9fb-8725-4fd2-a6c9-74208912add3",
          "471abbbe-7bf4-4764-b02c-db9aa0e3c714"
        ],
        "baseline-tool-calling": [
          "215471f6-3dac-486d-bda4-28248363c386",
          "d4a1f476-496c-4614-a249-449a821c29ee",
          "1d21addb-6b4f-4092-97a7-a8fb6e651c9e",
          "bc4c5936-7061-423e-960b-7f8ebbc792f4",
          "664abf25-d18d-4c82-a361-a8d30cee9014"
        ]
      }
    },
    {
      "id": "research-01",
      "category": "金融研究",
      "message": "宁德时代现在什么价",
      "groups": {
        "baseline-tool-calling": {
          "correct": 5,
          "hallucinated": 0,
          "total": 5,
          "duration_p50_ms": 4546,
          "duration_p95_ms": 8790,
          "estimated_token_runs": 0
        },
        "full-system": {
          "correct": 5,
          "hallucinated": 0,
          "total": 5,
          "duration_p50_ms": 3364,
          "duration_p95_ms": 3513,
          "estimated_token_runs": 5
        },
        "langgraph-react": {
          "correct": 5,
          "hallucinated": 0,
          "total": 5,
          "duration_p50_ms": 6509,
          "duration_p95_ms": 11459,
          "estimated_token_runs": 0
        }
      },
      "run_ids": {
        "baseline-tool-calling": [
          "7c39696b-cc02-4bbc-a80a-501c9241629f",
          "d05d963e-749f-40fe-85d1-1ef859dd460d",
          "00325bcf-76ad-458f-9e94-fa122b00f14e",
          "f4b89b94-9b65-469b-b933-8941b6c1a670",
          "7c91f97a-6a8e-4acc-b68b-a5d7dc8a2395"
        ],
        "full-system": [
          "06a82b3b-22cf-45ed-8cda-358854bb45c1",
          "4f5f22c4-94e1-4318-8559-9055bd2d01ec",
          "869f7576-717e-4740-a3d9-b0a967291158",
          "71e14be1-67c3-4fa4-acc8-0be80810ca90",
          "06a99d4c-7948-4498-bad4-ec7957a5fdc8"
        ],
        "langgraph-react": [
          "a1ce2633-b140-4eec-b6c9-c981c45ca796",
          "021b587b-87fe-4188-bd0e-cd777f7392dc",
          "52232ed6-2d03-4233-a443-b27dee341634",
          "9ea9c9dd-228c-47a5-b37c-2d5f356e38e3",
          "729aca01-37d9-44e5-b01f-9e7dff227b1c"
        ]
      }
    },
    {
      "id": "suit-01",
      "category": "适合度",
      "message": "我的风险承受能力",
      "groups": {
        "baseline-tool-calling": {
          "correct": 5,
          "hallucinated": 0,
          "total": 5,
          "duration_p50_ms": 3702,
          "duration_p95_ms": 5251,
          "estimated_token_runs": 0
        },
        "full-system": {
          "correct": 5,
          "hallucinated": 0,
          "total": 5,
          "duration_p50_ms": 1984,
          "duration_p95_ms": 2506,
          "estimated_token_runs": 5
        },
        "langgraph-react": {
          "correct": 5,
          "hallucinated": 0,
          "total": 5,
          "duration_p50_ms": 9410,
          "duration_p95_ms": 16502,
          "estimated_token_runs": 0
        }
      },
      "run_ids": {
        "baseline-tool-calling": [
          "029bd121-9c11-401e-8f4a-dfb4586e79a5",
          "d06350f2-4cec-476d-b32d-855227a64b20",
          "01c51306-6fb5-491f-b62d-6e295d93759c",
          "76cda066-a713-434a-a5f9-70af6347fb38",
          "ffc9688a-f3c3-4195-a83f-926811e30e28"
        ],
        "langgraph-react": [
          "939b37ef-9c42-430a-86cd-ec706362e864",
          "3df2041f-2342-4b21-9197-b897bfbc044b",
          "60cec065-3545-442f-995b-412add32aaae",
          "2f232a20-638b-450b-b565-35d3b56c5422",
          "d37bc31d-684e-4678-94c6-14a47108ac1a"
        ],
        "full-system": [
          "9419bfdc-4034-4aa1-82ab-ad4e14997b3b",
          "bde2cbe5-a478-4a37-89de-10b7139c2ac3",
          "38798c11-2bcb-4ac6-8853-0b86873ac2aa",
          "cb8f577f-1359-45fa-a0ca-3afd7b5b913f",
          "03537ce3-95dd-418c-9954-0387f96dab19"
        ]
      }
    }
  ]
}
